{
  "schema_version": 1,
  "finding_id": "fnd_01JBQ2Z8Y3K4M5N6P7Q8R9S0T1",
  "incident_id": "inc_01JBQ2Z8Y3K4M5N6P7Q8R9S0T1",
  "agent": "metrics",
  "claim": "checkout p95 latency increased",
  "severity": "high",
  "evidence_ids": ["ev_01JBQ2Z8Y3K4M5N6P7Q8R9S0T1", "ev_01JBQ2Z8Y3K4M5N6P7Q8R9S0T2"],
  "time_window": { "start_at": "2026-10-22T05:45:00Z", "end_at": "2026-10-22T06:00:00Z" },
  "created_at": "2026-10-22T06:01:00Z"
}
